{
  "item_id": "silver.dimcurrency",
  "status": "partial",
  "coverage": "partial",
  "branch_manifest": [
    {
      "id": "dynamic_sql_insert",
      "statement_index": 0,
      "description": "INSERT INTO silver.DimCurrency (CurrencyAlternateKey, CurrencyName) executed via sp_executesql with a string variable — SQL is not statically resolvable at fixture-generation time",
      "scenarios": []
    }
  ],
  "unit_tests": [],
  "uncovered_branches": [
    "dynamic_sql_insert"
  ],
  "warnings": [
    {
      "code": "dynamic_sql_untestable",
      "message": "Write logic is embedded in sp_executesql called with a NVARCHAR variable (@sql), not a literal string. The INSERT SQL is not statically visible to the scoping agent, so fixture-based testing cannot reproduce this branch.",
      "item_id": "silver.dimcurrency",
      "severity": "warning",
      "details": {
        "routing_reason": "dynamic_sql_variable",
        "recovered_sql": "INSERT INTO silver.DimCurrency (CurrencyAlternateKey, CurrencyName) SELECT CurrencyCode, CurrencyName FROM MigrationTest.bronze_currency"
      }
    }
  ],
  "validation": {
    "passed": true,
    "issues": []
  },
  "errors": []
}
