{
  "item_id": "silver.dimcrossdbprofile",
  "status": "partial",
  "coverage": "partial",
  "branch_manifest": [
    {
      "id": "cross_db_exec_delegation",
      "statement_index": 0,
      "description": "EXEC [ArchiveDB].[silver].[usp_stage_DimCrossDbProfile]: entire write logic is delegated to a cross-database procedure in ArchiveDB; proc body is opaque and cannot be inspected or exercised in sandbox",
      "scenarios": []
    }
  ],
  "unit_tests": [],
  "uncovered_branches": [
    "cross_db_exec_delegation"
  ],
  "warnings": [
    {
      "code": "cross_db_untestable",
      "message": "silver.usp_load_DimCrossDbProfile delegates all write logic to EXEC [ArchiveDB].[silver].[usp_stage_DimCrossDbProfile]. The cross-database reference cannot be resolved in the sandbox environment; all branches are untestable. No unit tests can be generated for this table.",
      "item_id": "silver.dimcrossdbprofile",
      "severity": "warning",
      "details": {
        "cross_db_target": "[ArchiveDB].[silver].[usp_stage_DimCrossDbProfile]",
        "reason": "cross_database_procedure_inaccessible_in_sandbox"
      }
    }
  ],
  "validation": {
    "status": "ok",
    "summary": []
  },
  "errors": []
}
